date	review_id	sentiment	label_id	input_ids	review_body
2021-07-06T04:38:57Z	11013	0	1	[0, 100, 657, 5, 356, 9, 42, 3588, 359, 56, 239, 1991, 1437, 53, 24, 399, 75, 697, 62, 7, 106, 4, 33, 117, 2980, 14, 24, 16, 157, 156, 359, 2721, 1437, 1950, 9321, 19, 9869, 14901, 198, 5, 5397, 4, 939, 524, 195, 108, 401, 113, 1437, 18918, 29882, 19, 10, 618, 7755, 783, 18951, 14, 939, 1017, 101, 7, 7433, 1437, 98, 939, 4689, 42, 3588, 25, 5, 6173, 224, 24, 18, 10, 828, 7082, 359, 36341, 4, 939, 303, 24, 7, 28, 98, 7082, 14, 24, 1326, 380, 359, 4378, 35162, 127, 1955, 328, 939, 1687, 12926, 10, 650, 1437, 53, 1467, 14, 24, 21, 1622, 5, 847, 9, 5, 3588, 359, 164, 159, 10, 1836, 1979, 75, 24622, 2, 1, 1, 1, 1]	"I love the look of this dress & had high hopes  but it didn't live up to them. have no doubt that it is well made & beautiful  fully lined with lovely detailing around the neck. i am 5'6""  155lbs with a postpartum belly that i'd like to hide  so i chose this dress as the reviews say it's a bit loose & forgiving. i found it to be so loose that it looks big & entirely hides my figure! i considered ordering a small  but knew that it was simply the cut of the dress & going down a size wouldn't chang"
2021-07-06T04:38:57Z	5708	0	1	[0, 100, 1381, 15, 5, 6907, 11, 3023, 29, 11, 1400, 4, 24, 21, 98, 380, 15, 162, 4, 939, 770, 7, 657, 24, 1437, 5, 15240, 661, 222, 1437, 53, 939, 1299, 162, 298, 734, 98, 222, 277, 701, 26229, 1437, 399, 947, 10431, 3416, 131, 90, 101, 24, 15, 162, 4, 5, 8089, 32, 269, 2579, 36, 463, 5, 2440, 1302, 269, 2579, 350, 43, 1437, 53, 5, 847, 21, 10, 410, 1810, 4, 10199, 16, 182, 3793, 4, 13, 5135, 1437, 939, 524, 12312, 23246, 1437, 321, 16134, 1437, 973, 4, 245, 11, 13977, 4, 2, 1, 1, 1, 1, 1, 1, 1, 1, 1, 1, 1, 1, 1, 1, 1, 1, 1, 1, 1, 1, 1, 1, 1, 1, 1, 1, 1, 1, 1]	I tried on the pink in xs in store. it was so big on me. i wanted to love it  the stylist did  but i felt meh... so did another costumer  didn&#39;t like it on me. the colors are really nice (and the blue seems really nice too)  but the cut was a little wide. fabric is very soft. for reference  i am 115 lbs  0dd  26.5 in waist.
2021-07-06T04:38:57Z	15918	1	2	[0, 16587, 209, 13344, 328, 45, 350, 3229, 8, 45, 350, 765, 328, 51, 914, 98, 171, 13657, 328, 326, 1872, 13, 127, 543, 7, 2564, 1955, 328, 372, 13, 12729, 1437, 28177, 1437, 8, 95, 7, 28, 15652, 11, 328, 2, 1, 1, 1, 1, 1, 1, 1, 1, 1, 1, 1, 1, 1, 1, 1, 1, 1, 1, 1, 1, 1, 1, 1, 1, 1, 1, 1, 1, 1, 1, 1, 1, 1, 1, 1, 1, 1, 1, 1, 1, 1, 1, 1, 1, 1, 1, 1, 1, 1, 1, 1, 1, 1, 1, 1, 1, 1, 1, 1, 1, 1, 1, 1, 1, 1, 1, 1, 1, 1, 1, 1, 1, 1, 1, 1, 1, 1, 1, 1, 1, 1, 1, 1, 1, 1, 1]	Love these shorts! not too tight and not too short! they match so many tops! tts for my hard to fit figure! great for weekends  vacations  and just to be adorable in!
2021-07-06T04:38:57Z	6142	1	2	[0, 713, 23204, 95, 2035, 11, 127, 36661, 8, 24, 18, 416, 127, 2674, 2125, 9, 5296, 4, 24, 16, 5, 3793, 990, 631, 939, 308, 734, 8, 24, 2653, 98, 30847, 242, 4, 25, 5, 37102, 874, 1581, 35, 4420, 1437, 24, 34, 12189, 4, 51, 32, 34915, 12, 5827, 12189, 36, 27737, 596, 47, 64, 75, 192, 106, 11, 5, 1345, 43, 8, 5, 1273, 16, 20856, 19, 5, 276, 6129, 4617, 3520, 15, 5, 760, 9, 5, 23204, 4, 1437, 939, 437, 67, 10, 3097, 734, 53, 939, 202, 120, 22037, 13, 10, 12003, 1294, 98, 939, 218, 75, 1508, 8165, 22, 22376, 3361, 17707, 72, 939, 581, 1153, 3568, 42, 7, 3553, 2, 1, 1, 1, 1, 1, 1, 1, 1, 1, 1, 1]	"This sweater just arrived in my mailbox and it's already my favorite piece of clothing. it is the softest thing i own... and it feels so luxe. as the reviewer below noted: yes  it has pockets. they are slit-style pockets (probably why you can't see them in the photo) and the opening is trimmed with the same cable detail featured on the front of the sweater.  i'm also a professor... but i still get mistaken for a grad student so i don't mind appearing ""professorial."" i'll probably wear this to th"
2021-07-06T04:38:57Z	1410	1	2	[0, 713, 16, 10, 11962, 173, 8443, 1437, 25, 157, 25, 11153, 19, 10844, 4, 1437, 34203, 4, 182, 3793, 4, 1437, 129, 2764, 16, 42, 16, 7992, 19, 10, 3793, 13178, 14187, 1437, 98, 45, 372, 13, 1035, 11, 15001, 1437, 53, 40, 120, 2710, 9, 304, 42, 1136, 4, 3700, 231, 12, 398, 15, 5, 299, 1437, 939, 439, 19, 4761, 4, 1437, 45, 3229, 11, 5, 3701, 25, 97, 37102, 1581, 4, 2, 1, 1, 1, 1, 1, 1, 1, 1, 1, 1, 1, 1, 1, 1, 1, 1, 1, 1, 1, 1, 1, 1, 1, 1, 1, 1, 1, 1, 1, 1, 1, 1, 1, 1, 1, 1, 1, 1, 1, 1, 1, 1, 1, 1, 1, 1, 1, 1, 1, 1, 1, 1]	This is a cute work jacket  as well as paired with jeans.  flattering. very soft.  only con is this is thick with a soft cotton lining  so not great for summer in az  but will get plenty of use this fall. typically 6-8 on the top  i went with medium.  not tight in the arms as other reviewer noted.
